{"type":"config","name":"Game stream crossing-d2 total CPU time","metricName":"total_ms","metricUnit":"ms","bestDirection":"lower"}
{"run":1,"commit":"62c5fa9","metric":644,"metrics":{"stream_ms":223.79,"mesh_ms":171.56,"far_field_ms":248.65,"chunk_gen_ms":221.27,"max_frame_ms":35.52,"far_sample_cache_ms":202.61,"far_mesh_build_ms":45.96},"status":"keep","description":"Baseline: crossing-d2 total=644ms (stream=224, mesh=172, far=249)","timestamp":1773398148461,"segment":0}
{"run":2,"commit":"62c5fa9","metric":650.18,"metrics":{"stream_ms":227.93,"mesh_ms":170.54,"far_field_ms":251.72,"chunk_gen_ms":225.06,"max_frame_ms":35.89,"far_sample_cache_ms":205.06,"far_mesh_build_ms":46.56},"status":"discard","description":"Inline hashUint32 into noise.ts - no improvement (650 vs 644), noise overhead is already well-optimized","timestamp":1773398329293,"segment":0}
{"run":3,"commit":"c0163f2","metric":637.52,"metrics":{"stream_ms":230.46,"mesh_ms":154.72,"far_field_ms":252.34,"chunk_gen_ms":227.38,"max_frame_ms":35.32,"far_sample_cache_ms":206.5,"far_mesh_build_ms":45.75},"status":"keep","description":"Replace DataView with Float32Array/Uint32Array for vertex writing in mesher.ts and far-field. Mesh 172→155ms (-10%)","timestamp":1773398564548,"segment":0}
{"run":4,"commit":"c0163f2","metric":645.12,"metrics":{"stream_ms":225.43,"mesh_ms":169.83,"far_field_ms":249.86,"chunk_gen_ms":223.07,"max_frame_ms":35.64,"far_sample_cache_ms":203.93,"far_mesh_build_ms":45.87},"status":"discard","description":"Convert mesher quad arrays from number[] to Int32Array - regression, mesh 155→170ms due to appendQuad overhead","timestamp":1773398811155,"segment":0}
{"run":5,"commit":"c0163f2","metric":664.46,"metrics":{"stream_ms":234.63,"mesh_ms":179.47,"far_field_ms":250.36,"chunk_gen_ms":230.54,"max_frame_ms":36.52,"far_sample_cache_ms":203,"far_mesh_build_ms":47.22},"status":"discard","description":"Reusable scratch object for far-field cell sampling - no improvement, total 664 vs 637","timestamp":1773398962131,"segment":0}
{"run":6,"commit":"75880df","metric":555.96,"metrics":{"stream_ms":240,"mesh_ms":161.42,"far_field_ms":154.54,"chunk_gen_ms":235.68,"max_frame_ms":31.19,"far_sample_cache_ms":107.15,"far_mesh_build_ms":47.21},"status":"keep","description":"Cache last column summary + inline column sampling in sampleFarFieldColumn. Far sample cache 203→107ms (-47%), total 637→556ms (-13%)","timestamp":1773399310152,"segment":0}
{"run":7,"commit":"75880df","metric":580.07,"metrics":{"stream_ms":235.08,"mesh_ms":175.3,"far_field_ms":169.69,"chunk_gen_ms":230.81,"max_frame_ms":32.24,"far_sample_cache_ms":123.49,"far_mesh_build_ms":46.04},"status":"discard","description":"4-slot hashed column cache - worse than 1-slot (580 vs 556), hash overhead + collisions","timestamp":1773399429744,"segment":0}
{"run":8,"commit":"805a0a8","metric":555.39,"metrics":{"stream_ms":220.55,"mesh_ms":172.48,"far_field_ms":162.36,"chunk_gen_ms":218.05,"max_frame_ms":29.9,"far_sample_cache_ms":119.29,"far_mesh_build_ms":43.01},"status":"keep","description":"Early Y-exit in voxel loop + replace Math.min/max with branches in tight loop. chunk_gen 236→218ms (-8%), total 556→555ms","timestamp":1773399551083,"segment":0}
{"run":9,"commit":"805a0a8","metric":585.48,"metrics":{"stream_ms":230.2,"mesh_ms":184.34,"far_field_ms":170.95,"chunk_gen_ms":225.55,"max_frame_ms":31.91,"far_sample_cache_ms":124.98,"far_mesh_build_ms":45.79},"status":"discard","description":"Inline above-surface fast path in voxel loop - JIT regression, 585 vs 555","timestamp":1773399681099,"segment":0}
{"run":10,"commit":"805a0a8","metric":596.49,"metrics":{"stream_ms":236.09,"mesh_ms":184.47,"far_field_ms":175.93,"chunk_gen_ms":231.19,"max_frame_ms":32.73,"far_sample_cache_ms":127.81,"far_mesh_build_ms":47.89},"status":"discard","description":"Precomputed packed normals in far-field - no improvement (596 vs 555), likely noise","timestamp":1773399816002,"segment":0}
{"run":11,"commit":"6ac31e0","metric":597.57,"metrics":{"stream_ms":245.76,"mesh_ms":167.45,"far_field_ms":184.35,"chunk_gen_ms":240.56,"max_frame_ms":37.19,"far_sample_cache_ms":133.67,"far_mesh_build_ms":50.54},"status":"keep","description":"Re-baseline with 5 iterations + 2 warmup for stability. Previous 555 was 3 iter. True baseline ~598ms","timestamp":1773399954570,"segment":0}
{"run":12,"commit":"6e70589","metric":545.83,"metrics":{"stream_ms":214.94,"mesh_ms":168.67,"far_field_ms":162.22,"chunk_gen_ms":212.91,"max_frame_ms":29.24,"far_sample_cache_ms":119.59,"far_mesh_build_ms":42.61},"status":"keep","description":"Reusable scratch objects for SurfaceFieldSample, CaveFieldSample, and fillSurfaceColumnState return. chunk_gen 241→213ms (-12%), total 598→546ms (-8.7%)","timestamp":1773400207074,"segment":0}
{"run":13,"commit":"6d6dd41","metric":545.7,"metrics":{"stream_ms":223.76,"mesh_ms":173.79,"far_field_ms":148.14,"chunk_gen_ms":220.41,"max_frame_ms":29.38,"far_sample_cache_ms":102.49,"far_mesh_build_ms":45.59},"status":"keep","description":"Reusable return object in sampleFarFieldColumn + 1-slot column cache. far_sample_cache 120→102ms (-15%)","timestamp":1773400370383,"segment":0}
{"run":14,"commit":"e0ab4c2","metric":523.97,"metrics":{"stream_ms":226.97,"mesh_ms":145.46,"far_field_ms":151.54,"chunk_gen_ms":222.38,"max_frame_ms":29.67,"far_sample_cache_ms":104.67,"far_mesh_build_ms":46.77},"status":"keep","description":"Precomputed opaque mask Uint8Array in mesher - avoids isWaterMaterial virtual dispatch in tight loop. Mesh 174→145ms (-16%), total 546→524ms (-4%)","timestamp":1773400618964,"segment":0}
{"run":15,"commit":"5e3ee35","metric":507.47,"metrics":{"stream_ms":221.57,"mesh_ms":141.24,"far_field_ms":144.66,"chunk_gen_ms":218.61,"max_frame_ms":28.14,"far_sample_cache_ms":101.42,"far_mesh_build_ms":43.18},"status":"keep","description":"Reusable BaseBiomeBlendSelection object in selectBaseBiomes. chunk_gen 222→219ms, total 524→507ms (-3.2%)","timestamp":1773400841515,"segment":0}
{"run":16,"commit":"f1cc4fd","metric":484.35,"metrics":{"stream_ms":205.73,"mesh_ms":138.17,"far_field_ms":140.45,"chunk_gen_ms":203.57,"max_frame_ms":26.66,"far_sample_cache_ms":97.49,"far_mesh_build_ms":42.94},"status":"keep","description":"Replace averageSignal(...args) with fixed-arity avg3/4/5 + reusable regionalVariant. Eliminates ~26 array allocations per column. chunk_gen 219→204ms (-7%), total 507→484ms (-4.6%)","timestamp":1773401158967,"segment":0}
